{
    "name": "falco-falco",
    "version": "1.1.1",
    "description": "Sample-backed Falco events with source-specific entities.",
    "maintainers": [
        {
            "name": "John Owen",
            "email": "jowen@ftsc.com"
        }
    ],
    "tags": [
        "falco"
    ],
    "templates": [
        "runtime-alert/terminal-shell"
    ]
}
