{
    "name": "slack-enterprise",
    "version": "1.1.1",
    "description": "Sample-backed Slack Enterprise events with source-specific entities.",
    "maintainers": [
        {
            "name": "John Owen",
            "email": "jowen@ftsc.com"
        }
    ],
    "tags": [
        "slack",
        "enterprise"
    ],
    "templates": [
        "audit/user-login"
    ]
}
