{
  "name": "github-enterprise-cloud",
  "version": "1.0.0",
  "description": "Sample-backed GitHub Enterprise Cloud events with source-specific entities.",
  "maintainers": [
    {
      "name": "John Owen",
      "email": "jowen@ftsc.com"
    }
  ],
  "tags": [
    "github",
    "enterprise-cloud"
  ],
  "templates": [
    "organization-audit/team-add-member"
  ]
}
