{
  "name": "okta-auth0",
  "version": "1.0.0",
  "description": "Sample-backed Auth0 events with source-specific entities.",
  "maintainers": [
    {
      "name": "John Owen",
      "email": "jowen@ftsc.com"
    }
  ],
  "tags": [
    "okta",
    "auth0"
  ],
  "templates": [
    "authentication/wrong-password"
  ]
}
