{
    "name": "aws-s3",
    "version": "1.1.0",
    "description": "Sample-backed Amazon S3 events with source-specific entities.",
    "maintainers": [
        {
            "name": "John Owen",
            "email": "jowen@ftsc.com"
        }
    ],
    "tags": [
        "aws",
        "s3"
    ],
    "templates": [
        "server-access/documented-operations"
    ]
}
