{
    "name": "aws-cloudtrail",
    "version": "1.1.2",
    "description": "AWS CloudTrail event templates for management and data events",
    "maintainers": [
        {
            "name": "John Owen",
            "email": "jowen@ftsc.com"
        }
    ],
    "tags": [
        "aws",
        "cloud",
        "audit",
        "compliance",
        "security",
        "api-activity"
    ],
    "templates": [
        "management/delete_trail",
        "management/iam_delete_policy",
        "management/ec2_create_snapshot"
    ]
}
