{
    "name": "f5-nginx",
    "version": "1.1.1",
    "description": "Sample-backed NGINX events with source-specific entities.",
    "maintainers": [
        {
            "name": "John Owen",
            "email": "jowen@ftsc.com"
        }
    ],
    "tags": [
        "f5",
        "nginx"
    ],
    "templates": [
        "access/combined-get-success"
    ]
}
