{
  "name": "aws-route53-resolver",
  "version": "1.0.0",
  "description": "Sample-backed Route 53 Resolver events with source-specific entities.",
  "maintainers": [
    {
      "name": "John Owen",
      "email": "jowen@ftsc.com"
    }
  ],
  "tags": [
    "aws",
    "route53-resolver"
  ],
  "templates": [
    "dns-query/a-query-success"
  ]
}
