{
    "name": "microsoft-windows",
    "version": "1.2.1",
    "description": "Microsoft Windows Event Log templates collection",
    "maintainers": [
        {
            "name": "John Owen",
            "email": "jowen@ftsc.com"
        }
    ],
    "tags": [
        "windows",
        "eventlog",
        "system",
        "security",
        "microsoft"
    ],
    "templates": [
        "security-4625/locked-out-interactive",
        "system/clop_persistence"
    ]
}
