{
    "name": "aws-alb",
    "version": "1.1.0",
    "description": "Sample-backed Application Load Balancer events with source-specific entities.",
    "maintainers": [
        {
            "name": "John Owen",
            "email": "jowen@ftsc.com"
        }
    ],
    "tags": [
        "aws",
        "alb"
    ],
    "templates": [
        "access/http-forward-success"
    ]
}
