{
    "name": "armis-security-platform",
    "version": "1.1.1",
    "description": "MELTr templates for Armis Security Platform alerts including policy violations, threat detections, and device security events",
    "maintainers": [
        {
            "name": "John Owen",
            "email": "jowen@ftsc.com",
            "github": "jowen-ftsc"
        }
    ],
    "tags": [
        "armis",
        "security",
        "iot",
        "device-security",
        "policy-violation",
        "threat-detection",
        "network-security",
        "compliance"
    ],
    "templates": [
        "policy-violation/system_policy_violation"
    ]
}
