{
    "name": "hashicorp-vault",
    "version": "1.1.1",
    "description": "Sample-backed Vault events with source-specific entities.",
    "maintainers": [
        {
            "name": "John Owen",
            "email": "jowen@ftsc.com"
        }
    ],
    "tags": [
        "hashicorp",
        "vault"
    ],
    "templates": [
        "audit/enable-file-response"
    ]
}
