{
  "name": "cisco-duo",
  "version": "1.0.0",
  "description": "Sample-backed Duo events with source-specific entities.",
  "maintainers": [
    {
      "name": "John Owen",
      "email": "jowen@ftsc.com"
    }
  ],
  "tags": [
    "cisco",
    "duo"
  ],
  "templates": [
    "authentication/push-success"
  ]
}
