{
    "name": "proofpoint-email-protection",
    "version": "1.1.0",
    "description": "Proofpoint Email Protection security event templates",
    "maintainers": [
        {
            "name": "John Owen",
            "email": "jowen@ftsc.com"
        }
    ],
    "tags": [
        "email-security",
        "threat-detection",
        "proofpoint"
    ],
    "templates": [
        "security/messages_blocked"
    ]
}
