{
    "name": "paloalto-wildfire",
    "version": "1.1.0",
    "description": "MELTr templates for Palo Alto WildFire threat detection logs",
    "maintainers": [
        {
            "name": "John Owen",
            "email": "jowen@ftsc.com",
            "github": "jowen-ftsc"
        }
    ],
    "tags": [
        "wildfire",
        "threat",
        "malware",
        "security"
    ],
    "templates": [
        "threats/wildfire_threat_detected"
    ]
}
