{
    "name": "fortinet-fortigate",
    "version": "1.1.0",
    "description": "Sample-backed FortiGate events with source-specific entities.",
    "maintainers": [
        {
            "name": "John Owen",
            "email": "jowen@ftsc.com"
        }
    ],
    "tags": [
        "fortinet",
        "fortigate"
    ],
    "templates": [
        "forward-traffic/https-close"
    ]
}
